<?xml version="1.0" encoding="UTF-8"?>
<!DOCTYPE JET-FINDERS SYSTEM "jet_finder2.dtd">
<JET-FINDERS>
    <BEAN name="Portfolio">
        <FINDER name="findAll">
            <FINDERBODY type="sql" sql_string="" buffersize="-1"/>
        </FINDER>
        <FINDER name="findByPreparedSQLQuery">
            <INPUT name="sqlWhereClause" type="String" localizedDisplayableText=""/>
            <INPUT name="sqlArguments" type="Object[]" localizedDisplayableText=""/>
            <FINDERBODY type="sql" sql_string="where @@@_SQL" buffersize="-1"/>
        </FINDER>
    </BEAN>
    <BEAN name="Share">
        <FINDER name="findAll">
            <FINDERBODY type="sql" sql_string="" buffersize="-1"/>
        </FINDER>
        <FINDER name="findByPreparedSQLQuery">
            <INPUT name="sqlWhereClause" type="String" localizedDisplayableText=""/>
            <INPUT name="sqlArguments" type="Object[]" localizedDisplayableText=""/>
            <FINDERBODY type="sql" sql_string="where @@@_SQL" buffersize="-1"/>
        </FINDER>
    </BEAN>
    <BEAN name="ShareQuantity">
        <FINDER name="findAll">
            <FINDERBODY type="sql" sql_string="" buffersize="-1"/>
        </FINDER>
        <FINDER name="findByShareAndPortfolio">
            <INPUT name="idPortfolio" type="Long" localizedDisplayableText=""/>
            <INPUT name="idShare" type="Long" localizedDisplayableText=""/>
            <FINDERBODY type="sql" sql_string="where idPortfolio = ? and idShare = ? order by valueDate asc" buffersize="-1"/>
        </FINDER>
        <FINDER name="findByPortfolio">
            <INPUT name="idPortfolio" type="Long" localizedDisplayableText=""/>
            <FINDERBODY type="sql" sql_string="where idPortfolio = ? order by valueDate asc" buffersize="-1"/>
        </FINDER>
        <FINDER name="findByPreparedSQLQuery">
            <INPUT name="sqlWhereClause" type="String" localizedDisplayableText=""/>
            <INPUT name="sqlArguments" type="Object[]" localizedDisplayableText=""/>
            <FINDERBODY type="sql" sql_string="where @@@_SQL" buffersize="-1"/>
        </FINDER>
    </BEAN>
    <BEAN name="ShareValue">
        <FINDER name="findAll">
            <FINDERBODY type="sql" sql_string="" buffersize="-1"/>
        </FINDER>
        <FINDER name="findByShare">
            <INPUT name="idShare" type="Long" localizedDisplayableText=""/>
            <FINDERBODY type="sql" sql_string="where idShare = ? order by valueDate asc" buffersize="-1"/>
        </FINDER>
        <FINDER name="findByShareAndDate">
            <INPUT name="idShare" type="Long" localizedDisplayableText=""/>
            <INPUT name="valueDate" type="java.util.Date" localizedDisplayableText=""/>
            <FINDERBODY type="sql" sql_string="where idShare = ? and valueDate &lt;= ? order by valueDate desc limit 1" buffersize="-1"/>
        </FINDER>
        <FINDER name="findByPreparedSQLQuery">
            <INPUT name="sqlWhereClause" type="String" localizedDisplayableText=""/>
            <INPUT name="sqlArguments" type="Object[]" localizedDisplayableText=""/>
            <FINDERBODY type="sql" sql_string="where @@@_SQL" buffersize="-1"/>
        </FINDER>
    </BEAN>
</JET-FINDERS>
